{
  "schema": 1,
  "kind": "person",
  "items": [
    {
      "id": "lenin",
      "title_ru": "В. И. ЛЕНИН (УЛЬЯНОВ)",
      "camp": "red",
      "dates_display_ru": "1870–1924",
      "lead_media": "media/persons/lenin/01",
      "lead_w": 2628,
      "lead_h": 1892,
      "sort_key_ru": "в. и. ленин ульянов",
      "has_card": true,
      "lead_tiers": [
        "lg",
        "sm",
        "xs"
      ]
    },
    {
      "id": "kolchak",
      "title_ru": "А. В. КОЛЧАК",
      "camp": "white",
      "dates_display_ru": "1874–1920",
      "lead_media": "media/persons/kolchak/01",
      "lead_w": 1350,
      "lead_h": 1245,
      "sort_key_ru": "а. в. колчак",
      "has_card": true,
      "lead_tiers": [
        "lg",
        "sm",
        "xs"
      ]
    },
    {
      "id": "grigorev",
      "title_ru": "Н. А. ГРИГОРЬЕВ (СЕРВЕТНИКОВ)",
      "dates_display_ru": "1884(?)–1919",
      "lead_media": "media/persons/grigorev/01",
      "lead_w": 788,
      "lead_h": 1562,
      "sort_key_ru": "н. а. григорьев серветников",
      "has_card": true,
      "camp": "national",
      "lead_tiers": [
        "lg",
        "sm",
        "xs"
      ]
    },
    {
      "id": "avksentiev",
      "title_ru": "Авксентьев",
      "has_card": true,
      "title_full_ru": "Н. Д. АВКСЕНТЬЕВ",
      "camp": "green",
      "dates_display_ru": "1878–1943",
      "lead_media": "media/persons/avksentiev/01",
      "lead_w": 2506,
      "lead_h": 3430,
      "sort_key_ru": "авксентьев",
      "lead_tiers": [
        "lg",
        "sm",
        "xs"
      ]
    },
    {
      "id": "budyonny",
      "title_ru": "Будённый",
      "has_card": true,
      "title_full_ru": "С. М. БУДЁННЫЙ",
      "camp": "red",
      "dates_display_ru": "1883–1973",
      "lead_media": "media/persons/budyonny/01",
      "lead_w": 2540,
      "lead_h": 3306,
      "sort_key_ru": "буденный",
      "lead_tiers": [
        "lg",
        "sm",
        "xs"
      ]
    },
    {
      "id": "denikin",
      "title_ru": "Деникинъ",
      "has_card": true,
      "title_full_ru": "А. И. ДЕНИКИН",
      "camp": "white",
      "dates_display_ru": "1872–1947",
      "lead_media": "media/persons/denikin/01",
      "lead_w": 1375,
      "lead_h": 2106,
      "sort_key_ru": "деникинъ",
      "lead_tiers": [
        "lg",
        "sm",
        "xs"
      ]
    },
    {
      "id": "frunze",
      "title_ru": "Фрунзе",
      "has_card": true,
      "title_full_ru": "М. В. ФРУНЗЕ",
      "camp": "red",
      "dates_display_ru": "1885–1925",
      "lead_media": "media/persons/frunze/01",
      "lead_w": 1271,
      "lead_h": 1764,
      "sort_key_ru": "фрунзе",
      "lead_tiers": [
        "lg",
        "sm",
        "xs"
      ]
    },
    {
      "id": "kornilov",
      "title_ru": "Корниловъ",
      "has_card": true,
      "title_full_ru": "Л. Г. КОРНИЛОВ",
      "camp": "white",
      "dates_display_ru": "1870–1918",
      "lead_media": "media/persons/kornilov/01",
      "lead_w": 1297,
      "lead_h": 1856,
      "sort_key_ru": "корниловъ",
      "lead_tiers": [
        "lg",
        "sm",
        "xs"
      ]
    },
    {
      "id": "makhno",
      "title_ru": "Махно",
      "has_card": true,
      "title_full_ru": "Н. И. МАХНО",
      "camp": "green",
      "dates_display_ru": "1888–1934",
      "lead_media": "media/persons/makhno/01",
      "lead_w": 1872,
      "lead_h": 2400,
      "sort_key_ru": "махно",
      "lead_tiers": [
        "lg",
        "sm",
        "xs"
      ]
    },
    {
      "id": "pilsudski",
      "title_ru": "Пилсудскій",
      "has_card": true,
      "title_full_ru": "Ю. ПИЛСУДСКИЙ",
      "camp": "green",
      "dates_display_ru": "1867–1935",
      "lead_media": "media/persons/pilsudski/01",
      "lead_w": 3513,
      "lead_h": 4799,
      "sort_key_ru": "пилсудскій",
      "lead_tiers": [
        "lg",
        "sm",
        "xs"
      ]
    },
    {
      "id": "semyonov",
      "title_ru": "Семёновъ",
      "has_card": true,
      "title_full_ru": "Г. М. СЕМЁНОВ",
      "camp": "white",
      "dates_display_ru": "1890–1946",
      "lead_media": "media/persons/semyonov/01",
      "lead_w": 600,
      "lead_h": 789,
      "sort_key_ru": "семеновъ",
      "lead_tiers": [
        "lg",
        "xs"
      ]
    },
    {
      "id": "trotsky",
      "title_ru": "Троцкій",
      "has_card": true,
      "title_full_ru": "Л. Д. ТРОЦКИЙ",
      "camp": "red",
      "dates_display_ru": "1879–1940",
      "lead_media": "media/persons/trotsky/01",
      "lead_w": 2349,
      "lead_h": 3535,
      "sort_key_ru": "троцкій",
      "lead_tiers": [
        "lg",
        "sm",
        "xs"
      ]
    },
    {
      "id": "tukhachevsky",
      "title_ru": "Тухачевскій",
      "has_card": true,
      "title_full_ru": "М. Н. Тухачевский",
      "camp": "red",
      "dates_display_ru": "1893–1937",
      "lead_media": "media/persons/tukhachevsky/01",
      "lead_w": 1119,
      "lead_h": 1719,
      "sort_key_ru": "тухачевскій",
      "lead_tiers": [
        "lg",
        "sm",
        "xs"
      ]
    },
    {
      "id": "wrangel",
      "title_ru": "Врангель",
      "has_card": true,
      "title_full_ru": "П. Н. ВРАНГЕЛЬ",
      "camp": "white",
      "dates_display_ru": "1878–1928",
      "lead_media": "media/persons/wrangel/01",
      "lead_w": 1734,
      "lead_h": 2685,
      "sort_key_ru": "врангель",
      "lead_tiers": [
        "lg",
        "sm",
        "xs"
      ]
    },
    {
      "id": "yudenich",
      "title_ru": "Юденичъ",
      "has_card": true,
      "title_full_ru": "Н. Н. ЮДЕНИЧ",
      "camp": "white",
      "dates_display_ru": "1862–1933",
      "lead_media": "media/persons/yudenich/01",
      "lead_w": 800,
      "lead_h": 1282,
      "sort_key_ru": "юденичъ",
      "lead_tiers": [
        "lg",
        "sm",
        "xs"
      ]
    },
    {
      "id": "alekseev",
      "title_ru": "АЛЕКСЕЕВ",
      "has_card": true,
      "title_full_ru": "М. В. АЛЕКСЕЕВ",
      "dates_display_ru": "1857–1918",
      "lead_media": "media/persons/alekseev/01",
      "lead_w": 756,
      "lead_h": 1199,
      "sort_key_ru": "алексеев",
      "camp": "white",
      "lead_tiers": [
        "lg",
        "sm",
        "xs"
      ]
    },
    {
      "id": "anvelt",
      "title_ru": "АНВЕЛЬТ",
      "has_card": true,
      "title_full_ru": "Я. Я. АНВЕЛЬТ",
      "dates_display_ru": "1884–1937",
      "lead_media": "media/persons/anvelt/01",
      "lead_w": 884,
      "lead_h": 1136,
      "sort_key_ru": "анвельт",
      "camp": "red",
      "lead_tiers": [
        "lg",
        "sm",
        "xs"
      ]
    },
    {
      "id": "blyukher",
      "title_ru": "БЛЮХЕР",
      "has_card": true,
      "title_full_ru": "В. К. БЛЮХЕР",
      "dates_display_ru": "1890–1938",
      "lead_media": "media/persons/blyukher/01",
      "lead_w": 1017,
      "lead_h": 1544,
      "sort_key_ru": "блюхер",
      "camp": "red",
      "lead_tiers": [
        "lg",
        "sm",
        "xs"
      ]
    },
    {
      "id": "bogaevskiy",
      "title_ru": "БОГАЕВСКИЙ",
      "has_card": true,
      "title_full_ru": "А. П. БОГАЕВСКИЙ",
      "dates_display_ru": "1872–1934",
      "lead_media": "media/persons/bogaevskiy/01",
      "lead_w": 800,
      "lead_h": 1025,
      "sort_key_ru": "богаевский",
      "camp": "white",
      "lead_tiers": [
        "lg",
        "sm",
        "xs"
      ]
    },
    {
      "id": "boldyrev",
      "title_ru": "БОЛДЫРЕВ",
      "has_card": true,
      "title_full_ru": "В. Г. БОЛДЫРЕВ",
      "dates_display_ru": "1875–1933",
      "lead_media": "media/persons/boldyrev/01",
      "lead_w": 848,
      "lead_h": 1184,
      "sort_key_ru": "болдырев",
      "lead_tiers": [
        "lg",
        "sm",
        "xs"
      ]
    },
    {
      "id": "bukeykhanov",
      "title_ru": "БУКЕЙХАНОВ",
      "has_card": true,
      "title_full_ru": "А. Н. БУКЕЙХАНОВ",
      "dates_display_ru": "1870–1937",
      "lead_media": "media/persons/bukeykhanov/01",
      "lead_w": 923,
      "lead_h": 1204,
      "sort_key_ru": "букейханов",
      "camp": "national",
      "lead_tiers": [
        "lg",
        "sm",
        "xs"
      ]
    },
    {
      "id": "bych",
      "title_ru": "БЫЧ",
      "has_card": true,
      "title_full_ru": "Л. Л. БЫЧ",
      "dates_display_ru": "1870–1945",
      "lead_media": "media/persons/bych/01",
      "lead_w": 620,
      "lead_h": 870,
      "sort_key_ru": "быч",
      "camp": "national",
      "lead_tiers": [
        "lg",
        "xs"
      ]
    },
    {
      "id": "vatsetis",
      "title_ru": "ВАЦЕТИС",
      "has_card": true,
      "title_full_ru": "И. И. ВАЦЕТИС",
      "dates_display_ru": "1873–1938",
      "lead_media": "media/persons/vatsetis/01",
      "lead_w": 1535,
      "lead_h": 2046,
      "sort_key_ru": "вацетис",
      "camp": "red",
      "lead_tiers": [
        "lg",
        "sm",
        "xs"
      ]
    },
    {
      "id": "vologodskiy",
      "title_ru": "ВОЛОГОДСКИЙ",
      "has_card": true,
      "title_full_ru": "П. В. ВОЛОГОДСКИЙ",
      "dates_display_ru": "1863–1925",
      "lead_media": "media/persons/vologodskiy/01",
      "lead_w": 560,
      "lead_h": 810,
      "sort_key_ru": "вологодский",
      "camp": "rev-dem",
      "lead_tiers": [
        "lg",
        "xs"
      ]
    },
    {
      "id": "volskiy",
      "title_ru": "ВОЛЬСКИЙ",
      "has_card": true,
      "title_full_ru": "В. К. ВОЛЬСКИЙ",
      "dates_display_ru": "1877–1937",
      "lead_media": "media/persons/volskiy/01",
      "lead_w": 249,
      "lead_h": 400,
      "sort_key_ru": "вольский",
      "camp": "rev-dem",
      "lead_tiers": [
        "lg"
      ]
    },
    {
      "id": "voroshilov",
      "title_ru": "ВОРОШИЛОВ",
      "has_card": true,
      "title_full_ru": "К. Е. ВОРОШИЛОВ",
      "dates_display_ru": "1881–1969",
      "lead_media": "media/persons/voroshilov/01",
      "lead_w": 1014,
      "lead_h": 1610,
      "sort_key_ru": "ворошилов",
      "camp": "red",
      "lead_tiers": [